<?xml version="1.0" encoding="UTF-8"?>
<clearpool xmlns:xsi="http://www.w3.org/2001/XMLSchema-instance"  
       xsi:noNamespaceSchemaLocation="clearpool.xsd">  
	<console>
		<port>8085</port>
		<security>
			<user>1</user>
			<password>1</password>
		</security>
	</console>
	<distribute-url>clearpool/jta/clearpool-test-jta-distributed1.xml</distribute-url>
	<distribute-url>clearpool/jta/clearpool-test-jta-distributed2.xml</distribute-url>
</clearpool>