<?xml version="1.0" encoding="UTF-8" standalone="no"?>
<clearpool xmlns:xsi="http://www.w3.org/2001/XMLSchema-instance"
	xsi:noNamespaceSchemaLocation="clearpool.xsd">
	<console>
		<port>8085</port>
		<security>
			<user>1</user>
			<password>1</password>
		</security>
	</console>
	<!-- we get cfgs by distribute-url. -->
	<distribute-url>clearpool-jdbc.xml</distribute-url>
	<distribute-url>clearpool-jndi.xml</distribute-url>
</clearpool>