<?xml version="1.0" encoding="UTF-8"?>
<clearpool xmlns:xsi="http://www.w3.org/2001/XMLSchema-instance"
	xsi:noNamespaceSchemaLocation="clearpool.xsd">
	<alias>myclearpool</alias>
	<jdbc>
		<jdbc-class>com.mysql.jdbc.Driver</jdbc-class>
		<url>jdbc:mysql://127.0.0.1:3306/test?characterEncoding=gbk</url>
		<user>root</user>
		<password>1</password>
	</jdbc>
	<jta-support>true</jta-support>
	<core-pool-size>10</core-pool-size>
	<max-pool-size>50</max-pool-size>
	<acquire-increment>5</acquire-increment>
	<acquire-retry-times>3</acquire-retry-times>
	<limit-idle-time>5</limit-idle-time>
	<keep-test-period>20</keep-test-period>
	<test-table-name>test</test-table-name>
	<show-sql>true</show-sql>
</clearpool>